id,text,结果字段-“本地人”身份认定,结果字段-宽容或严格,结果字段-表达宽容或严格的短语,补充说明
suzhou_39_0,首先得会讲苏州话吧,社会文化与心理标准|个人的语言能力,紧缩排斥,,标签一致; 语气依据规则选择 紧缩排斥
suzhou_7_0,报祖上4代在苏州干啥的。日本扫荡没死透现在我估计都去上海北京了，真说本土祖上三代几乎都外地的，挖挖祖坟应该都外地迁的，真的。反驳我的话说说家族史，给我开开眼。,客观标准|家族在当地的历史传承,紧缩排斥,,标签一致; 语气依据规则选择 紧缩排斥
suzhou_103_0,苏州有个护城河，里面的就是苏州人,客观标准|城市内部地理片区归属,中性,,标签一致
suzhou_137_0,护城河里算土著，姑苏区范围算新苏州人，那几个离得近的算别的市，但张家港太仓这些离得远的按别的省来算,客观标准|城市内部地理片区归属,紧缩排斥,,标签一致
suzhou_136_11,是的呢，老一辈为了快速融入新的环境，迫不得已。但他们的小辈姑苏情节特别重，以一口正宗苏州话为傲。常强调自己是正宗苏州人，会讲正宗苏州话。,社会文化与心理标准|个人的语言能力; 社会文化与心理标准|个人被社群接纳,紧缩排斥,,标签一致; 语气依据规则选择 紧缩排斥
